{
  "schema_version": "1.0",
  "phase": "8B",
  "corpus_status": "frozen",
  "experiment_status": "preregistering",
  "created_at": "2026-09-03",
  "frozen_at": "2026-09-03T12:09:43Z",
  "source_of_truth_issue": "https://github.com/TensorScholar/proofdiff/issues/18",
  "targets": {
    "new_historical_cases": 20,
    "minimum_repositories": 5,
    "control_cases": 3
  },
  "cases": [
    {
      "case_id": "pydantic-xai-stream-tool-boundary-7925",
      "arm": "historical",
      "eligibility": "qualified",
      "repo": "pydantic/pydantic-ai",
      "source_kind": "upstream_commit",
      "source_url": "https://github.com/pydantic/pydantic-ai/commit/8453eff1c25f17c885c292a18c1d58e3832fd52d",
      "pr_number": 7925,
      "upstream_reference": "issue #7923",
      "base_sha": "f8853dca678e781480898bafd7b946276c38bb1f",
      "head_sha": "8453eff1c25f17c885c292a18c1d58e3832fd52d",
      "candidate_repo": null,
      "title": "Fix XaiModel streamed text after a native tool call being merged into the ended pre-call part",
      "criticality": "high",
      "confounding_risk": "low",
      "behavior_surfaces": ["streaming", "native-tools", "provider-adapter", "output-validation"],
      "protected_invariants": [
        "Text streamed after a native tool call remains a distinct live part and reaches final output.",
        "A delta is never applied to a part whose lifecycle already ended."
      ],
      "oracle": {
        "paths": ["tests/models/test_xai.py"],
        "tests": [
          "test_xai_stream_text_after_server_side_tool_call_returns_output",
          "test_xai_stream_interleaved_text_part_lifecycle_events"
        ],
        "source_url": "https://github.com/pydantic/pydantic-ai/commit/8453eff1c25f17c885c292a18c1d58e3832fd52d"
      },
      "discrimination_reason": "A one-line provider adapter change crosses stream part identity, native-tool boundaries, CallToolsNode semantics, and retry exhaustion; a coarse model/provider tag is expected to over-select sibling xAI behavior.",
      "family_id": "pydantic-stream-tool-lifecycle",
      "notes": "Direct upstream commit with explicit pre-fix failure explanation and focused regression tests."
    },
    {
      "case_id": "pydantic-cancel-first-tool-resume-7993",
      "arm": "historical",
      "eligibility": "qualified",
      "repo": "pydantic/pydantic-ai",
      "source_kind": "upstream_commit",
      "source_url": "https://github.com/pydantic/pydantic-ai/commit/1467456556b9109b5b92eb7c7def8eabb5287775",
      "pr_number": 7993,
      "upstream_reference": null,
      "base_sha": "78acea8fab822f482eefbf4cbb26e8a84668eb51",
      "head_sha": "1467456556b9109b5b92eb7c7def8eabb5287775",
      "candidate_repo": null,
      "title": "Keep a run cancelled during its first tool call resumable",
      "criticality": "high",
      "confounding_risk": "low",
      "behavior_surfaces": ["cancellation", "tool-execution", "message-history", "resume"],
      "protected_invariants": [
        "Cancellation during the first or only tool call records an interrupted request even when no tool completed.",
        "Interrupted history synthesizes missing tool returns and can resume with or without a new prompt."
      ],
      "oracle": {
        "paths": ["tests/test_agent.py", "tests/test_cancellation.py"],
        "tests": [
          "test_failed_run_history_is_resumable",
          "test_cancel_during_only_tool_call_is_resumable",
          "test_cancel_during_only_tool_call_is_resumable_without_a_new_prompt"
        ],
        "source_url": "https://github.com/pydantic/pydantic-ai/commit/1467456556b9109b5b92eb7c7def8eabb5287775"
      },
      "discrimination_reason": "The blast radius crosses abnormal termination, tool lifecycle, persisted message state, provider-valid history repair, and future resume semantics rather than a single path-local function.",
      "family_id": "pydantic-interrupted-history",
      "notes": "Oracle names are taken from the upstream regression patch; exact source URL is canonical if upstream later moves tests."
    },
    {
      "case_id": "pydantic-deferred-cross-category-7626",
      "arm": "historical",
      "eligibility": "qualified",
      "repo": "pydantic/pydantic-ai",
      "source_kind": "upstream_commit",
      "source_url": "https://github.com/pydantic/pydantic-ai/commit/2dbcf1dff61b439d4dcb9f027a764802cc669b6e",
      "pr_number": 7626,
      "upstream_reference": null,
      "base_sha": "194fb2ad5521b97a415709649a3618a27caa03fc",
      "head_sha": "2dbcf1dff61b439d4dcb9f027a764802cc669b6e",
      "candidate_repo": null,
      "title": "Fix DeferredToolRequests.remaining resolving cross-category result IDs",
      "criticality": "high",
      "confounding_risk": "low",
      "behavior_surfaces": ["deferred-tools", "approvals", "external-actions", "resume"],
      "protected_invariants": [
        "An approval result can resolve only an approval request with the same ID.",
        "A call result can resolve only a deferred call with the same ID.",
        "A cross-category result cannot resume the model or execute an external call."
      ],
      "oracle": {
        "paths": ["tests/test_capabilities.py"],
        "tests": [
          "test_deferred_tool_requests_remaining_cross_category_ids_do_not_resolve",
          "test_deferred_tool_handler_ignores_cross_category_ids"
        ],
        "source_url": "https://github.com/pydantic/pydantic-ai/commit/2dbcf1dff61b439d4dcb9f027a764802cc669b6e"
      },
      "discrimination_reason": "The safety property is semantic category ownership of an ID; file or component tags cannot explain why a same textual ID in a different result category must not authorize progress.",
      "family_id": "pydantic-deferred-tool-ownership",
      "notes": "Small focused production diff plus explicit no-external-call regression oracle."
    },
    {
      "case_id": "pydantic-ui-stream-cancel-state-7675",
      "arm": "historical",
      "eligibility": "qualified",
      "repo": "pydantic/pydantic-ai",
      "source_kind": "upstream_commit",
      "source_url": "https://github.com/pydantic/pydantic-ai/commit/897d40cd17f8b84c0e99fe5d38e7c763c3110216",
      "pr_number": 7675,
      "upstream_reference": null,
      "base_sha": "2d18ef8ec3644ead8381ca42bdf5ee5a1e80ed33",
      "head_sha": "897d40cd17f8b84c0e99fe5d38e7c763c3110216",
      "candidate_repo": null,
      "title": "Fix stale UIEventStream part state on cancellation",
      "criticality": "high",
      "confounding_risk": "low",
      "behavior_surfaces": ["streaming", "cancellation", "ui-events", "tool-call-deltas"],
      "protected_invariants": [
        "Synthetic PartEnd emitted on cancellation reflects all deltas already exposed to the client.",
        "Cleanup errors do not replace the original stream failure."
      ],
      "oracle": {
        "paths": ["tests/ui/test_event_stream.py"],
        "tests": [
          "test_cancelled_part_end_contains_accumulated_part",
          "test_part_end_delta_matches_handler_output_on_error",
          "test_part_cleanup_error_does_not_replace_stream_error"
        ],
        "source_url": "https://github.com/pydantic/pydantic-ai/commit/897d40cd17f8b84c0e99fe5d38e7c763c3110216",
        "notes": "Upstream commit carries parametrized text, thinking, function-tool and native-tool cases."
      },
      "discrimination_reason": "The invariant depends on temporal correspondence between emitted deltas and synthetic cleanup state, not merely the UIEventStream component membership.",
      "family_id": "pydantic-stream-tool-lifecycle",
      "notes": "Same broad stream family as #7925; family-aware analysis prevents overweighting correlated cases."
    },
    {
      "case_id": "pydantic-cohere-zero-arg-tool-7720",
      "arm": "historical",
      "eligibility": "qualified",
      "repo": "pydantic/pydantic-ai",
      "source_kind": "upstream_commit",
      "source_url": "https://github.com/pydantic/pydantic-ai/commit/49a4e6f5aeb62936d5134ea5aff644263248b754",
      "pr_number": 7720,
      "upstream_reference": null,
      "base_sha": "ae37b7fd495a934e7d8322ce81836ee6c3868aa6",
      "head_sha": "49a4e6f5aeb62936d5134ea5aff644263248b754",
      "candidate_repo": null,
      "title": "Fix dropped zero-argument tool calls in CohereModel",
      "criticality": "high",
      "confounding_risk": "low",
      "behavior_surfaces": ["provider-adapter", "tool-calls", "history-roundtrip", "retry"],
      "protected_invariants": [
        "Falsy None or empty-string arguments do not cause a valid named zero-argument tool call to be dropped.",
        "The zero-argument tool call survives the assistant/tool history round trip without a retry prompt."
      ],
      "oracle": {
        "paths": ["tests/models/test_cohere.py"],
        "tests": [
          "test_zero_argument_tool_call",
          "test_zero_argument_tool_call_round_trip",
          "test_tool_call_without_function_skipped"
        ],
        "source_url": "https://github.com/pydantic/pydantic-ai/commit/49a4e6f5aeb62936d5134ea5aff644263248b754"
      },
      "discrimination_reason": "A generic truthiness check changes provider parsing, tool execution, retry behavior, and request-history validity; the protected behavior is narrower than a Cohere model tag.",
      "family_id": "pydantic-provider-tool-parsing",
      "notes": "Very small production change with extensive upstream regression coverage."
    },
    {
      "case_id": "adk-function-response-temporal-ownership-6761",
      "arm": "historical",
      "eligibility": "qualified",
      "repo": "google/adk-python",
      "source_kind": "upstream_commit",
      "source_url": "https://github.com/google/adk-python/commit/deee6d2c474ccb9710e0b25a0b290bb76cc54c45",
      "pr_number": null,
      "upstream_reference": "closes #6761",
      "base_sha": "2aea8595fb1c5e0fddef7893a1985dc96dc82692",
      "head_sha": "deee6d2c474ccb9710e0b25a0b290bb76cc54c45",
      "candidate_repo": null,